Ticker,Name,Weight,Shares,Price
600519 CH Equity,Kweichow Moutai Co Ltd,5.287326,1256.1978,1876
601398 CH Equity,ICBC,2.619224,269612.2125,4.33
601288 CH Equity,Agricultural Bank of China Ltd,2.034167,319244.2108,2.84
601857 CH Equity,PetroChina Co Ltd,1.863669,161922.0778,5.13
600036 CH Equity,China Merchants Bank Co Ltd,1.534284,20628.94443,33.15
601988 CH Equity,Bank of China Ltd,1.428077,210765.5148,3.02
600900 CH Equity,China Yangtze Power Co Ltd,1.218954,22741.85923,23.89
601628 CH Equity,China Life Insurance Co Ltd,1.214711,20823.53,26
601088 CH Equity,China Shenhua Energy Co Ltd,1.048929,16491.03796,28.35
601318 CH Equity,Ping An Insurance Group Co of China Ltd,0.981888,10832.6645,40.4
601012 CH Equity,LONGi Green Energy Technology Co Ltd,0.981712,7578.133791,57.74
600028 CH Equity,China Petroleum & Chemical Corp,0.881157,95557.77105,4.11
601888 CH Equity,China Tourism Group Duty Free Corp Ltd,0.858592,1952.475544,196
603288 CH Equity,Foshan Haitian Flavouring & Food Co Ltd,0.811236,4633.833787,78.03
601166 CH Equity,Industrial Bank Co Ltd,0.808665,20774.19075,17.35
600809 CH Equity,Shanxi Fen Wine,0.747515,1220.114372,273.07
601658 CH Equity,Postal Savings Bank of China Co Ltd,0.732255,72527.80061,4.5
600309 CH Equity,Wanhua Chemical Group Co Ltd,0.576297,3139.746626,81.81
600030 CH Equity,CITIC Securities Co Ltd,0.533225,12200.46997,19.48
600276 CH Equity,Jiangsu Hengrui Medicine Co Ltd,0.527394,6379.002274,36.85
603259 CH Equity,WuXi AppTec Co Ltd,0.524296,2563.742716,91.15
600438 CH Equity,Tongwei Co Ltd,0.518618,4501.548184,51.35
600887 CH Equity,YILI,0.516218,6400.130918,35.95
601816 CH Equity,Beijing-Shanghai High Speed Railway Co L,0.494687,49106.48461,4.49
600000 CH Equity,Shanghai Pudong Development Bank Co Ltd,0.466908,29352.17186,7.09
601668 CH Equity,CSCEC,0.453555,41940.85884,4.82
601633 CH Equity,Great Wall Motor Co Ltd,0.43707,6158.95419,31.63
601225 CH Equity,Shaanxi Coal Industry Co Ltd,0.435469,9695,20.02
600406 CH Equity,NARI Technology Co Ltd,0.428072,6694.630847,28.5
601138 CH Equity,Foxconn Industrial Internet Co Ltd,0.426528,19865.10401,9.57
600104 CH Equity,SAIC Motor Corp Ltd,0.423602,11683.46137,16.16
601899 CH Equity,Zijin Mining Group Co Ltd,0.408417,20592.37224,8.84
688599 CH Equity,Trina Solar Co Ltd,0.405639,2167.587415,83.41
601328 CH Equity,Bank of Communications Co Ltd,0.402449,39250.86402,4.57
600048 CH Equity,PRE,0.400699,11970.28369,14.92
600436 CH Equity,PIEN TZE HUANG,0.39666,603.31721,293.04
601919 CH Equity,COSCO SHIPPING Holdings Co Ltd,0.380879,12659.40478,13.41
600905 CH Equity,China Three Gorges New Energy (Group) Co,0.377572,28620.51,5.88
601066 CH Equity,CSC Financial Co Ltd,0.369006,6495.671035,25.32
601319 CH Equity,People's Insurance Co Group of China Ltd,0.359189,35497.75658,4.51
600346 CH Equity,Hengli Petrochemical Co Ltd,0.328809,7039.099786,20.82
601998 CH Equity,China CITIC Bank Corp Ltd,0.325466,34052.68038,4.26
600893 CH Equity,AECC Aviation Power Co Ltd,0.324683,2665.594238,54.29
600690 CH Equity,Haier Smart Home Co Ltd,0.322708,6308.552654,22.8
600031 CH Equity,Sany Heavy Industry Co Ltd,0.307747,8493.286021,16.15
603260 CH Equity,Hoshine Silicon Industry Co Ltd,0.304865,1074.165577,126.5
601601 CH Equity,China Pacific Insurance Group Co Ltd,0.297782,6845.041455,19.39
688303 CH Equity,Xinjiang Daqo New Energy Co Ltd,0.29775,2137.396215,62.09
600760 CH Equity,AVIC Shenyang Aircraft Co Ltd,0.297351,1960.544999,67.6
600009 CH Equity,Shanghai International Airport Co Ltd,0.296044,2360.897773,55.89
603799 CH Equity,Zhejiang Huayou Cobalt Co Ltd,0.295044,1587.645518,82.83
603501 CH Equity,Will Semiconductor Co Ltd Shanghai,0.294687,1183.827425,110.95
600585 CH Equity,Anhui Conch Cement Co Ltd,0.29048,3999.702579,32.37
600016 CH Equity,China Minsheng Banking Corp Ltd,0.28563,35462.12321,3.59
600025 CH Equity,Huaneng Lancang River Hydropower Inc,0.283501,18000,7.02
600018 CH Equity,Shanghai International Port Group Co Ltd,0.280464,23278.67975,5.37
600188 CH Equity,Yankuang Energy Group Co Ltd,0.279006,3048.70364,40.79
601766 CH Equity,CRRC Corp Ltd,0.275638,24327.79805,5.05
601995 CH Equity,China International Capital Corp Ltd,0.269192,2923.54244,41.04
603392 CH Equity,Beijing Wantai Biological Pharmacy Enter,0.265753,880.208,134.57
600111 CH Equity,CNRE,0.264423,3633.066,32.44
600019 CH Equity,Baoshan Iron & Steel Co Ltd,0.263296,22268.41155,5.27
601818 CH Equity,China Everbright Bank Co Ltd,0.261639,41353.18523,2.82
601985 CH Equity,China National Nuclear Power Co Ltd,0.258388,18848.93022,6.11
601390 CH Equity,China Railway Group Ltd,0.252928,20534.26368,5.49
600050 CH Equity,China United Network Communications Ltd,0.248204,30988.13161,3.57
601238 CH Equity,Guangzhou Automobile Group Co Ltd,0.245394,7365.337352,14.85
601009 CH Equity,Bank of Nanjing Co Ltd,0.241855,10305.72478,10.46
601211 CH Equity,Guotai Junan Securities Co Ltd,0.240259,7514.844451,14.25
601669 CH Equity,Power Construction Corp of China Ltd,0.238901,15299.03502,6.96
600703 CH Equity,Sanan Optoelectronics Co Ltd,0.23788,4479.341308,23.67
600989 CH Equity,Ningxia Baofeng Energy Group Co Ltd,0.233963,7333.36,14.22
600150 CH Equity,China CSSC Holdings Ltd,0.228783,4472.428758,22.8
603806 CH Equity,Hangzhou First Applied Material Co Ltd,0.227285,1331.545247,76.08
600919 CH Equity,Bank of Jiangsu Co Ltd,0.225995,14769.63913,6.82
603659 CH Equity,Shanghai Putailai New Energy Technology,0.223,1390.903678,71.46
600999 CH Equity,China Merchants Securities Co Ltd,0.222138,7422.005272,13.34
600010 CH Equity,Inner Mongolia BaoTou Steel Union Co Ltd,0.21989,45585.03265,2.15
601127 CH Equity,Seres Group Co Ltd,0.21766,1497.124564,64.8
603993 CH Equity,CMOC Group Ltd,0.212839,17665.77258,5.37
601688 CH Equity,Huatai Securities Co Ltd,0.211131,7357.60432,12.79
601111 CH Equity,Air China Ltd,0.208312,9962.131821,9.32
601006 CH Equity,Daqin Railway Co Ltd,0.204802,14866.9186,6.14
600089 CH Equity,TBEA Co Ltd,0.202723,3790.111289,23.84
600745 CH Equity,Wingtech Technology Co Ltd,0.202004,1246.338965,72.24
601800 CH Equity,China Communications Construction Co Ltd,0.201888,11747.23543,7.66
600196 CH Equity,FOSUN PHARMA,0.201835,2117.714711,42.48
600837 CH Equity,Haitong Securities Co Ltd,0.201232,9654.63118,9.29
601689 CH Equity,Ningbo Tuopu Group Co Ltd,0.199436,1102.046572,80.66
688012 CH Equity,Advanced Micro-Fabrication Equipment Inc,0.198819,616.24448,143.8
688111 CH Equity,Beijing Kingsoft Office Software Inc,0.196972,461,190.44
601169 CH Equity,Bank of Beijing Co Ltd,0.195438,21142.98427,4.12
605117 CH Equity,Ningbo Deye Technology Co Ltd,0.194578,238.9338,362.97
601989 CH Equity,China Shipbuilding Industry Co Ltd,0.191845,22802.03532,3.75
603195 CH Equity,Gongniu Group Co Ltd,0.190479,601.18052,141.22
600732 CH Equity,Shanghai Aiko Solar Energy Co Ltd,0.188688,2036.329187,41.3
603986 CH Equity,GigaDevice Semiconductor Inc,0.188614,667.467102,125.95
601229 CH Equity,Bank of Shanghai Co Ltd,0.185507,14206.64884,5.82
601186 CH Equity,China Railway Construction Corp Ltd,0.185048,11503.2455,7.17
688981 CH Equity,SMIC,0.184838,1938.463,42.5
601898 CH Equity,China Coal Energy Co Ltd,0.183569,9152.0004,8.94
600522 CH Equity,Jiangsu Zhongtian Technology Co Ltd,0.179717,3412.949652,23.47
600926 CH Equity,Bank of Hangzhou Co Ltd,0.178023,5930.26505,13.38
600015 CH Equity,Huaxia Bank Co Ltd,0.177447,15387.22398,5.14
600029 CH Equity,China Southern Airlines Co Ltd,0.173162,12673.30246,6.09
600660 CH Equity,Fuyao Glass Industry Group Co Ltd,0.16933,2002.986332,37.68
600886 CH Equity,SDIC Power Holdings Co Ltd,0.169082,7454.179797,10.11
601877 CH Equity,Zhejiang Chint Electrics Co Ltd,0.168153,2149.973551,34.86
600600 CH Equity,Tsingtao Brewery Co Ltd,0.167156,709.285615,105.04
688396 CH Equity,China Resources Microelectronics Ltd,0.167102,1320.091861,56.42
603290 CH Equity,StarPower Semiconductor Ltd,0.165637,170.60606,432.73
600588 CH Equity,Yonyou Network Technology Co Ltd,0.164056,3434.563809,21.29
601868 CH Equity,China Energy Engineering Corp Ltd,0.161521,32428.72764,2.22
600011 CH Equity,Huaneng Power International Inc,0.15915,10997.70992,6.45
603833 CH Equity,Oppein Home Group Inc,0.157716,609.151948,115.4
688008 CH Equity,Montage Technology Co Ltd,0.15669,1132.824111,61.65
688363 CH Equity,Bloomage Biotechnology Corp Ltd,0.156605,481.085277,145.09
601865 CH Equity,Flat Glass Group Co Ltd,0.155332,1696.893254,40.8
600547 CH Equity,Shandong Gold Mining Co Ltd,0.153105,3614.443347,18.88
600256 CH Equity,Guanghui Energy Co Ltd,0.151728,6565.755139,10.3
600085 CH Equity,Beijing Tongrentang Co Ltd,0.151021,1371.470262,49.08
600795 CH Equity,GD Power Development Co Ltd,0.14966,17835.61908,3.74
600233 CH Equity,YTO Express Group Co Ltd,0.147942,3436.146954,19.19
601100 CH Equity,Jiangsu Hengli Hydraulic Co Ltd,0.147782,1305.36,50.46
601615 CH Equity,Ming Yang Smart Energy Group Ltd,0.147311,2260.185706,29.05
600115 CH Equity,China Eastern Airlines Corp Ltd,0.145055,13697.6623,4.72
600958 CH Equity,Orient Securities Co Ltd/China,0.144123,7469.482864,8.6
600460 CH Equity,Hangzhou Silan Microelectronics Co Ltd,0.143923,1416.071845,45.3
603185 CH Equity,Wuxi Shangji Automation Co Ltd,0.143498,385.316336,165.99
600741 CH Equity,Huayu Automotive Systems Co Ltd,0.142601,3152.723984,20.16
688063 CH Equity,Pylon Technologies Co Ltd,0.142153,154.844533,409.18
600426 CH Equity,Shandong Hualu Hengsheng Chemical Co Ltd,0.139431,2122.479999,29.28
605499 CH Equity,Eastroc Beverage Group Co Ltd,0.138173,400.01,153.96
600570 CH Equity,Hundsun Technologies Inc,0.137462,1461.56048,41.92
688126 CH Equity,National Silicon Industry Group Co Ltd,0.137201,2720.298399,22.48
600884 CH Equity,Ningbo Shanshan Co Ltd,0.136063,2161.254038,28.06
600845 CH Equity,Shanghai Baosight Software Co Ltd,0.135379,1473.506507,40.95
601018 CH Equity,Ningbo Zhoushan Port Co Ltd,0.13406,15807.41737,3.78
601600 CH Equity,Aluminum Corp of China Ltd,0.133806,13078.70698,4.56
600176 CH Equity,China Jushi Co Ltd,0.132297,4003.136728,14.73
603369 CH Equity,Jiangsu King's Luck Brewery JSC Ltd,0.132202,1254.5,46.97
601618 CH Equity,Metallurgical Corp of China Ltd,0.126972,17852.61917,3.17
601336 CH Equity,New China Life Insurance Co Ltd,0.125769,2085.43934,26.88
601881 CH Equity,China Galaxy Securities Co Ltd,0.125248,6446.274124,8.66
601788 CH Equity,Everbright Securities Co Ltd,0.124815,3906.698839,14.24
688005 CH Equity,Ningbo Ronbay New Energy Technology Co L,0.124727,448.037632,124.08
600132 CH Equity,Chongqing Brewery Co Ltd,0.124274,483.971198,114.45
601117 CH Equity,CNCEC,0.12405,6109.470588,9.05
600674 CH Equity,Sichuan Chuantou Energy Co Ltd,0.123867,4406.15609,12.53
601872 CH Equity,China Merchants Energy Shipping Co Ltd,0.122969,8107.841801,6.76
601360 CH Equity,360 Security Technology Inc,0.1228,7145.363197,7.66
601727 CH Equity,Shanghai Electric Group Co Ltd,0.121808,12655.32709,4.29
600702 CH Equity,Shede Spirits Co Ltd,0.120484,332.042979,161.73
601916 CH Equity,China Zheshang Bank Co Ltd,0.120003,16714.69678,3.2
688036 CH Equity,Shenzhen Transsion Holdings Co Ltd,0.119378,801.69095,66.37
601838 CH Equity,Bank of Chengdu Co Ltd,0.119054,3612.251334,14.69
600754 CH Equity,JINJIANG SHARES,0.118615,914.044063,57.84
688122 CH Equity,Western Superconducting Technologies Co,0.117856,464.046069,113.2
603688 CH Equity,Jiangsu Pacific Quartz Co Ltd,0.11778,353.15158,148.65
603606 CH Equity,Ningbo Orient Wires & Cables Co Ltd,0.117635,687.715368,76.24
601939 CH Equity,China Construction Bank Corp,0.117523,9593.657606,5.46
601901 CH Equity,Founder Securities Co Ltd,0.117466,8232.101395,6.36
600584 CH Equity,JCET Group Co Ltd,0.113909,1779.553,28.53
600765 CH Equity,AVIC Heavy Machinery Co Ltd,0.113136,1472.29409,34.25
600918 CH Equity,Zhongtai Securities Co Ltd,0.112727,6968.625756,7.21
603613 CH Equity,Beijing United Information Technology Co,0.11227,498.655409,100.35
603486 CH Equity,Ecovacs Robotics Co Ltd,0.112051,573.921875,87.02
600096 CH Equity,Yunnan Yuntianhua Co Ltd,0.111213,1835.893241,27
600803 CH Equity,ENN Natural Gas Co Ltd,0.111098,2845.853619,17.4
600348 CH Equity,Shan Xi Hua Yang Group New Energy Co Ltd,0.110885,2405,20.55
603019 CH Equity,Dawning Information Industry Co Ltd,0.109513,1463.168974,33.36
688065 CH Equity,Cathay Biotech Inc,0.109461,583.170395,83.66
603605 CH Equity,Proya Cosmetics Co Ltd,0.109229,281.413952,173
600039 CH Equity,Sichuan Road & Bridge Co Ltd,0.10899,4804.943889,10.11
688390 CH Equity,Jiangsu GoodWe Power Supply Technology C,0.1078,123.2,390
603127 CH Equity,Joinn Laboratories China Co Ltd,0.107116,629.023489,75.9
600023 CH Equity,Zhejiang Zheneng Electric Power Co Ltd,0.10558,13600.68999,3.46
601607 CH Equity,Shanghai Pharmaceuticals Holding Co Ltd,0.105087,2776.434545,16.87
600236 CH Equity,Guangxi Guiguan Electric Power Co Ltd,0.105048,7882.377802,5.94
600875 CH Equity,Dongfang Electric Corp Ltd,0.10481,2779.00113,16.81
603568 CH Equity,WEIMING,0.104721,1694.21343,27.55
600763 CH Equity,Topchoice Medical Corp,0.104311,320.64,145
601698 CH Equity,China Satellite Communications Co Ltd,0.103475,4000,11.53
600160 CH Equity,Zhejiang Juhua Co Ltd,0.102426,2699.746081,16.91
600418 CH Equity,JAC,0.102362,2184.009791,20.89
600563 CH Equity,Xiamen Faratronic Co Ltd,0.101972,225,202
688536 CH Equity,3peak Inc,0.10099,80.235848,561
600383 CH Equity,Gemdale Corp,0.100681,4514.583572,9.94
601799 CH Equity,"Xingyu Co.,Ltd",0.099911,285.679419,155.88
600026 CH Equity,COSCO SHIP ENGY,0.099555,3474.776395,12.77
601021 CH Equity,Spring Airlines Co Ltd,0.098203,916.462713,47.76
603198 CH Equity,Anhui Yingjia Distillery Co Ltd,0.097857,800,54.52
601155 CH Equity,Seazen Holdings Co Ltd,0.096696,2263.586139,19.04
605358 CH Equity,Hangzhou Lion Electronics Co Ltd,0.096581,676.848359,63.6
600606 CH Equity,Greenland Holdings Corp Ltd,0.095857,14054.21831,3.04
600219 CH Equity,Shandong Nanshan Aluminum Co Ltd,0.095719,11950.48152,3.57
688819 CH Equity,Tianneng Battery Group Co Ltd,0.095223,972.1,43.66
600141 CH Equity,Hubei Xingfa Chemicals Group Co Ltd,0.094907,1111.724663,38.05
603893 CH Equity,Rockchip Electronics Co Ltd,0.094863,417.3472,101.31
601377 CH Equity,Industrial Securities Co Ltd,0.094806,6696.671674,6.31
688777 CH Equity,Zhejiang Supcon Technology Co Ltd,0.094558,496.823,84.83
689009 CH Equity,Ninebot Ltd,0.093218,715.12141,58.1
601699 CH Equity,lu'an EED,0.092283,2991.4092,13.75
603345 CH Equity,Anjoy Foods Group Co Ltd,0.09223,293.294232,140.16
600549 CH Equity,Xiamen Tungsten Co Ltd,0.090795,1418.4592,28.53
603596 CH Equity,Bethel Automotive Safety Systems Co Ltd,0.089718,408.4607,97.9
603899 CH Equity,Shanghai M&G Stationery Inc,0.089696,926.93305,43.13
688180 CH Equity,Shanghai Junshi Biosciences Co Ltd,0.089622,691.461,57.77
688099 CH Equity,Amlogic Shanghai Co Ltd,0.089232,411.12,96.74
601231 CH Equity,USISH,0.08887,2210.393238,17.92
601878 CH Equity,Zheshang Securities Co Ltd,0.088838,3878.168795,10.21
601236 CH Equity,Hongta Securities Co Ltd,0.08847,4716.787742,8.36
600885 CH Equity,Hongfa Technology Co Ltd,0.087748,1042.666173,37.51
601808 CH Equity,China Oilfield Services Ltd,0.087676,2960.468,13.2
600378 CH Equity,CTYC,0.08728,919.229657,42.32
600332 CH Equity,BAIYUNSHAN PH,0.086837,1405.890949,27.53
600298 CH Equity,Angel Yeast Co Ltd,0.08663,832.692943,46.37
600061 CH Equity,SDIC Capital Co Ltd,0.086351,6425.302701,5.99
600487 CH Equity,Hengtong Optic-electric Co Ltd,0.086335,2362.210486,16.29
600862 CH Equity,Avic Aviation High-Technology Co Ltd,0.085512,1393.049107,27.36
600183 CH Equity,Shengyi Technology Co Ltd,0.085138,2315.264608,16.39
688009 CH Equity,CHINA CRSC,0.084912,8621.018,4.39
601233 CH Equity,Tongkun Group Co Ltd,0.084876,2411.119493,15.69
688538 CH Equity,Everdisplay Optronics Shanghai Co Ltd,0.084763,13889.63319,2.72
688188 CH Equity,Shanghai Friendess Electronic Technology,0.084732,145.601101,259.38
688561 CH Equity,Qi An Xin Technology Group Inc,0.084275,682.082124,55.07
601058 CH Equity,Sailun Group Co Ltd,0.084197,3063.484772,12.25
601966 CH Equity,Shandong Linglong Tyre Co Ltd,0.084084,1484.246913,25.25
600372 CH Equity,China Avionics Systems Co Ltd,0.084057,1928.214265,19.43
600157 CH Equity,Wintime Energy Co Ltd,0.083744,22217.76415,1.68
688567 CH Equity,Farasis Energy Gan Zhou Co Ltd,0.083355,1070.669685,34.7
600499 CH Equity,Keda Industrial Group Co Ltd,0.083042,1888.419929,19.6
688301 CH Equity,iRay Technology Co Ltd,0.082605,72.547826,507.5
603868 CH Equity,flyco,0.082573,435.6,84.49
603816 CH Equity,Jason Furniture Hangzhou Co Ltd,0.082427,821.891519,44.7
688516 CH Equity,Wuxi Autowell Technology Co Ltd,0.082086,98.67,370.8
601216 CH Equity,JUNZHENG,0.081974,8438.01739,4.33
600399 CH Equity,Fushun Special Steel Co Ltd,0.08159,1972.1,18.44
600489 CH Equity,Zhongjin Gold Corp Ltd,0.081131,4847.312564,7.46
600027 CH Equity,Huadian Power International Corp Ltd,0.080664,8152.624615,4.41
603939 CH Equity,Yifeng Pharmacy Chain Co Ltd,0.080065,718.60973,49.66
600362 CH Equity,Jiangxi Copper Co Ltd,0.079246,2075.247405,17.02
600392 CH Equity,Shenghe Resources Holding Co Ltd,0.079125,1752.82657,20.12
603737 CH Equity,Skshu Paint Co Ltd,0.078934,376.437486,93.46
600482 CH Equity,China Shipbuilding Industry Group Power,0.078484,2160.682115,16.19
600988 CH Equity,Chifeng Jilong Gold Mining Co Ltd,0.078359,1663.911378,20.99
603456 CH Equity,Zhejiang Jiuzhou Pharmaceutical Co Ltd,0.078286,834.36113,41.82
600486 CH Equity,Jiangsu Yangnong Chemical Co Ltd,0.077998,309.898907,112.18
688778 CH Equity,XTC New Energy Materials Xiamen Co Ltd,0.077919,251.572267,138.05
603077 CH Equity,Sichuan Hebang Biotechnology Co Ltd,0.077868,8831.250228,3.93
688598 CH Equity,KBC Corp Ltd,0.076521,92.179373,370
688385 CH Equity,Shanghai Fudan Microelectronics Group Co,0.076461,530.172,64.28
600873 CH Equity,Meihua Holdings Group Co Ltd,0.076056,3098.619928,10.94
601696 CH Equity,BOC International China Co Ltd,0.075915,2778,12.18
600733 CH Equity,BAIC BluePark New Energy Technology Co L,0.075894,4287.31013,7.89
600779 CH Equity,Sichuan Swellfun Co Ltd,0.075756,488.365048,69.14
688116 CH Equity,Jiangsu Cnano Technology Co Ltd,0.075435,232.229186,144.78
600161 CH Equity,BTBP,0.075197,1647.809538,20.34
601991 CH Equity,DATANG POWER,0.074814,12396.08911,2.69
600079 CH Equity,Humanwell Healthcare Group Co Ltd,0.074708,1633.071908,20.39
600985 CH Equity,Huaibei Mining Holdings Co Ltd,0.074702,2481.035925,13.42
688690 CH Equity,Suzhou Nanomicro Technology Co Ltd,0.074604,400.145948,83.1
601108 CH Equity,Caitong Securities Co Ltd,0.074077,4643.73008,7.11
688521 CH Equity,Verisilicon Microelectronics Shanghai Co,0.073875,495.887148,66.4
603529 CH Equity,AIMA Technology Group Co Ltd,0.07387,574.700004,57.29
601636 CH Equity,Zhuzhou Kibing Group Co Ltd,0.07365,2686.308363,12.22
600673 CH Equity,Guangdong HEC Technology Holding Co Ltd,0.073503,3013.897259,10.87
688006 CH Equity,Zhejiang HangKe Technology Inc Co,0.071973,404.733,79.26
603882 CH Equity,Guangzhou Kingmed Diagnostics Group Co L,0.071795,465.791275,68.7
601555 CH Equity,SooChow Securities Co Ltd,0.071341,5007.502651,6.35
600352 CH Equity,Zhejiang Longsheng Group Co Ltd,0.071313,3253.33186,9.77
601933 CH Equity,Yonghui Superstores Co Ltd,0.070652,9075.036993,3.47
600153 CH Equity,Xiamen C & D Inc,0.070419,2977.85183,10.54
600416 CH Equity,Xiangtan Electric Manufacturing Co Ltd,0.070404,1154.9519,27.17
688017 CH Equity,Leader Harmonious Drive Systems Co Ltd,0.070351,168.58338,186
603876 CH Equity,Jiangsu Dingsheng New Energy Materials C,0.070349,489.162257,64.1
601990 CH Equity,Nanjing Securities Co Ltd,0.070218,3686.361034,8.49
600655 CH Equity,YYTM,0.07009,3890.382974,8.03
603267 CH Equity,Beijing Yuanliu Hongyuan Electronic Tech,0.069844,232.404,133.95
600517 CH Equity,State Grid Yingda Co Ltd,0.069795,5718.435744,5.44
600546 CH Equity,SCIE,0.069742,1982.45614,15.68
601077 CH Equity,Chongqing Rural Commercial Bank Co Ltd,0.069446,8843.663959,3.5
688169 CH Equity,Beijing Roborock Technology Co Ltd,0.069439,93.528834,330.91
601880 CH Equity,Liaoning Port Co Ltd,0.069279,18828.34982,1.64
600109 CH Equity,Sinolink Securities Co Ltd,0.069271,3724.35931,8.29
600521 CH Equity,Zhejiang Huahai Pharmaceutical Co Ltd,0.069196,1495.703146,20.62
603236 CH Equity,Quectel Wireless Solutions Co Ltd,0.068574,188.982076,161.73
600004 CH Equity,Baiyun Airport,0.068552,2366.718283,12.91
603707 CH Equity,NANJING KING-FRIEND BIOCHEMICAL PHARMACE,0.068284,1617.166526,18.82
603589 CH Equity,Anhui Kouzi Distillery Co Ltd,0.068062,600,50.56
603517 CH Equity,Juewei Food Co Ltd,0.067707,614.616995,49.1
688202 CH Equity,Shanghai Medicilon Inc,0.067647,86.916299,346.9
600848 CH Equity,Shanghai Lingang Holdings Corp Ltd,0.066654,2393.912273,12.41
600481 CH Equity,Shuangliang Eco-Energy Systems Co Ltd,0.066374,1627.255808,18.18
603233 CH Equity,DaShenLin Pharmaceutical Group Co Ltd,0.065757,949.115713,30.88
603826 CH Equity,Fujian Kuncai Material Technology Co Ltd,0.0653,468,62.19
600177 CH Equity,Youngor Group Co Ltd,0.064701,4628.902973,6.23
688200 CH Equity,Beijing Huafeng Test & Control Technolog,0.064555,61.49421,467.9
600916 CH Equity,China National Gold Group Gold Jewellery,0.064077,1680,17
600377 CH Equity,Jiangsu Expressway Co Ltd,0.063951,3815.7475,7.47
601666 CH Equity,Pingdingshan Tianan Coal Mining Co Ltd,0.063943,2315.215955,12.31
601298 CH Equity,Qingdao Port International Co Ltd,0.063876,5392.075,5.28
603026 CH Equity,SHANDONG SHIDA SHENGHUA,0.063754,202.68,140.2
600663 CH Equity,LJZ,0.063643,2933.46144,9.67
600705 CH Equity,AVIC Industry-Finance Holdings Co Ltd,0.063641,8919.974627,3.18
601677 CH Equity,Henan Mingtai Al Industrial Co Ltd,0.063209,965.819783,29.17
600497 CH Equity,Yunnan Chihong Zinc&Germanium Co Ltd,0.062711,5091.291568,5.49
688256 CH Equity,Cambricon Technologies Corp Ltd,0.06258,400.81465,69.59
600032 CH Equity,Zhejiang Provincial New Energy Investmen,0.062534,2080,13.4
601577 CH Equity,Bank of Changsha Co Ltd,0.062167,4021.553754,6.89
600338 CH Equity,Tibet Summit Resources Co Ltd,0.062128,914.210168,30.29
603160 CH Equity,Shenzhen Goodix Technology Co Ltd,0.061962,458.449914,60.24
601958 CH Equity,Jinduicheng Molybdenum Co Ltd,0.061823,3226.6044,8.54
600536 CH Equity,China National Software & Service Co Ltd,0.061777,659.994117,41.72
600641 CH Equity,Shanghai Wanye Enterprises Co Ltd,0.061467,957.930404,28.6
601156 CH Equity,Eastern Air Logistics Co Ltd,0.061442,1587.555556,17.25
600642 CH Equity,Shenergy Co Ltd,0.061385,4912.038316,5.57
600456 CH Equity,Baoji Titanium Industry Co Ltd,0.061176,477.777539,57.07
600415 CH Equity,YIWU CCC,0.061108,5491.274176,4.96
603658 CH Equity,Autobio Diagnostics Co Ltd,0.061046,586.272256,46.41
603885 CH Equity,Juneyao Airlines Co Ltd,0.060787,1966.144157,13.78
600038 CH Equity,AVICOPTER PLC,0.060705,589.476716,45.9
600872 CH Equity,JonJee Hi-tech,0.060698,796.637194,33.96
600956 CH Equity,China Suntien Green Energy Corp Ltd,0.060584,2348.088677,11.5
600516 CH Equity,Fangda Carbon New Material Co Ltd,0.059517,3805.970368,6.97
605111 CH Equity,Wuxi NCE Power Co Ltd,0.059463,199.9494,132.55
603565 CH Equity,Shanghai Zhonggu Logistics Co Ltd,0.059246,1418.961556,18.61
601168 CH Equity,Western Mining Co Ltd,0.059079,2383,11.05
600143 CH Equity,Kingfa Sci & Tech Co Ltd,0.058839,2573.622343,10.19
601866 CH Equity,COSCO SHIPPING Development Co Ltd,0.058701,9910.477301,2.64
603218 CH Equity,Riyue Heavy Industry Co Ltd,0.058614,967.593089,27
601198 CH Equity,Dongxing Securities Co Ltd,0.058599,3232.44552,8.08
600699 CH Equity,Ningbo Joyson Electronic Corp,0.058258,1368.084624,18.98
601456 CH Equity,Guolian Securities Co Ltd,0.057998,2389.133168,10.82
600906 CH Equity,Caida Securities Co Ltd,0.05788,3245,7.95
603786 CH Equity,Keboda Technology Co Ltd,0.05781,400.1,64.4
600118 CH Equity,China Spacesat Co Ltd,0.05773,1182.489135,21.76
688276 CH Equity,Changchun BCHT Biotechnology Co Ltd,0.057418,412.840698,61.99
601179 CH Equity,China XD Electric Co Ltd,0.057387,5125.882352,4.99
601162 CH Equity,Tianfeng Securities Co Ltd,0.057161,8665.757464,2.94
600021 CH Equity,Shanghai Electric Power Co Ltd,0.056624,2816.743645,8.96
600968 CH Equity,CNOOC Energy Technology & Services Ltd,0.056332,10165.1042,2.47
600871 CH Equity,Sinopec Oilfield Service Corp,0.056322,13569.37855,1.85
601158 CH Equity,Chongqing Water Group Co Ltd,0.056108,4800,5.21
600350 CH Equity,Shandong Hi-speed Co Ltd,0.056023,4811.165857,5.19
601016 CH Equity,CECEP Wind-Power Corp,0.056013,5013.160039,4.98
600299 CH Equity,Bluestar Adisseo Co,0.055839,2681.901273,9.28
603305 CH Equity,Ningbo Xusheng Auto Technology Co Ltd,0.055689,625.853875,39.66
600559 CH Equity,Hebei Hengshui Laobaigan Liquor Co Ltd,0.055659,914.747444,27.12
600369 CH Equity,Southwest Securities Co Ltd,0.055312,6645.109124,3.71
603156 CH Equity,Hebei Yangyuan Zhihui Beverage Co Ltd,0.055195,1265.4936,19.44
603678 CH Equity,Fujian Torch Electron Technology Co Ltd,0.055126,459.862748,53.43
600598 CH Equity,Heilongjiang Agriculture Co Ltd,0.05496,1777.679909,13.78
600295 CH Equity,Inner Mongolia ERDOS Resources Co Ltd,0.05493,1411.125896,17.35
601568 CH Equity,Shaanxi Beiyuan Chemical Industry Group,0.054275,3972.222224,6.09
600801 CH Equity,Huaxin Cement Co Ltd,0.054266,1361.879855,17.76
600170 CH Equity,Shanghai Construction Group Co Ltd,0.05394,8904.397728,2.7
601717 CH Equity,ZMJ,0.053735,1536.25947,15.59
600704 CH Equity,Wuchan Zhongda Group Co Ltd,0.053626,5196.03204,4.6
600315 CH Equity,Shanghai Jahwa United Co Ltd,0.05346,679.634461,35.06
688696 CH Equity,Chengdu XGimi Technology Co Ltd,0.053344,70,339.66
601001 CH Equity,DTCI,0.053247,1673.7,14.18
688520 CH Equity,Sinocelltech Group Ltd,0.053036,435.335714,54.3
